{
  "schemaVersion": "1.0",
  "traceId": "geometry_spin_demo_trace_v1",
  "frameIndex": 120,
  "accuracyTier": "reference",
  "display": {
    "width": 320,
    "height": 240,
    "crop": {
      "left": 4,
      "top": 8,
      "right": 315,
      "bottom": 231
    },
    "interlaced": false,
    "field": "progressive"
  },
  "hashes": {
    "frameCrc32": "CC1884A0",
    "frameFnv1a64": "2A21D6459B03FEC2",
    "commandTraceHash": "CBF9E0C8C6B26524"
  },
  "notes": [
    "Geometry-heavy sample used for raster parity across backends."
  ]
}
