{
  "schemaVersion": "1.0",
  "traceId": "fmv_subtitle_overlay_trace_v1",
  "frameIndex": 30,
  "accuracyTier": "reference",
  "display": {
    "width": 320,
    "height": 240,
    "crop": {
      "left": 0,
      "top": 0,
      "right": 319,
      "bottom": 239
    },
    "interlaced": true,
    "field": "odd"
  },
  "hashes": {
    "frameCrc32": "6E7A430C",
    "frameFnv1a64": "8C4AF3D14BEB5D87",
    "commandTraceHash": "9261A6F63A489A0A"
  },
  "notes": [
    "Captures FMV subtitle overlay + interlaced field metadata semantics."
  ]
}
